{
  "schemaVersion": "1.0",
  "profileId": "halloween_6_10",
  "description": "Six-act difficulty ramp for a 50-maze candy-collecting book, ages 6 to 10. Loop and dead-end ranges are PRD 17.4's normative table verbatim. Grids grow 8x8 to 18x18; the 0.375 in cell floor at 18x18 is the practical minimum for a child drawing with a pencil. Dead-end count rises only gently, 4-5 to 9-10, so dead-end density *falls* with grid size, from about 7% of cells at 8x8 to about 3% at 18x18: later mazes get their difficulty from the loop budget and the sheer distance to the finish, not from a proliferation of wrong turns, and every wrong turn stays short because the depth ceiling stays under seven steps everywhere.",
  "ageLabel": "6-10",
  "defaults": {
    "simpleRoutes": {
      "min": 8,
      "max": 200000
    },
    "minLoopLength": 6,
    "minMargin": 1,
    "shortestMayBeBest": false,
    "maxBestOverShortest": 1.6,
    "minTemptingRoutes": 2,
    "temptingFraction": 0.6,
    "maxRoutes": 200000,
    "maxSearchNodes": 4000000,
    "timeBudgetSeconds": 20.0,
    "candyPlacementTrials": 400,
    "frequencyBand": {
      "min": 0.3,
      "max": 0.7
    },
    "explorationShare": 0.35,
    "wallWidthPt": 3.0,
    "solutionWallWidthPt": 1.4,
    "solutionRouteWidthPt": 2.2,
    "collectibleScale": 0.55,
    "deadEndScale": 0.5,
    "startScale": 0.6,
    "finishScale": 0.7,
    "cellClearanceFraction": 0.12,
    "candySpacingPolicy": "no-adjacent-in-corridor-run",
    "maxBorderHugFraction": 0.5,
    "maxUnreachableFraction": 0.35,
    "outsideMarkerFraction": 0.085
  },
  "bands": [
    {
      "mazeIndexMin": 1,
      "mazeIndexMax": 10,
      "actName": "Getting Ready",
      "rows": 8,
      "cols": 8,
      "loops": {
        "min": 3,
        "max": 4
      },
      "deadEnds": {
        "min": 4,
        "max": 5
      },
      "deadEndDepth": {
        "min": 1,
        "max": 3
      },
      "candies": {
        "min": 5,
        "max": 7
      },
      "simpleRoutes": {
        "min": 6,
        "max": 200000
      },
      "minLoopLength": 6,
      "minMargin": 2,
      "minTemptingRoutes": 2,
      "wallWidthPt": 3.0,
      "solutionRouteWidthPt": 2.4,
      "collectibleScale": 0.6,
      "deadEndScale": 0.55
    },
    {
      "mazeIndexMin": 11,
      "mazeIndexMax": 20,
      "actName": "The Neighborhood",
      "rows": 10,
      "cols": 10,
      "loops": {
        "min": 4,
        "max": 5
      },
      "deadEnds": {
        "min": 5,
        "max": 6
      },
      "deadEndDepth": {
        "min": 1,
        "max": 4
      },
      "candies": {
        "min": 7,
        "max": 9
      },
      "simpleRoutes": {
        "min": 8,
        "max": 200000
      },
      "minLoopLength": 6,
      "minMargin": 2,
      "minTemptingRoutes": 3,
      "wallWidthPt": 3.0,
      "solutionRouteWidthPt": 2.3,
      "collectibleScale": 0.58,
      "deadEndScale": 0.52
    },
    {
      "mazeIndexMin": 21,
      "mazeIndexMax": 30,
      "actName": "The Dark End of the Street",
      "rows": 12,
      "cols": 12,
      "loops": {
        "min": 5,
        "max": 6
      },
      "deadEnds": {
        "min": 6,
        "max": 7
      },
      "deadEndDepth": {
        "min": 1,
        "max": 4
      },
      "candies": {
        "min": 9,
        "max": 11
      },
      "simpleRoutes": {
        "min": 10,
        "max": 200000
      },
      "minLoopLength": 6,
      "minMargin": 2,
      "minTemptingRoutes": 3,
      "wallWidthPt": 2.75,
      "solutionRouteWidthPt": 2.2,
      "collectibleScale": 0.56,
      "deadEndScale": 0.5
    },
    {
      "mazeIndexMin": 31,
      "mazeIndexMax": 40,
      "actName": "The Haunted Half Hour",
      "rows": 14,
      "cols": 14,
      "loops": {
        "min": 6,
        "max": 8
      },
      "deadEnds": {
        "min": 7,
        "max": 8
      },
      "deadEndDepth": {
        "min": 1,
        "max": 5
      },
      "candies": {
        "min": 11,
        "max": 13
      },
      "simpleRoutes": {
        "min": 12,
        "max": 200000
      },
      "minLoopLength": 6,
      "minMargin": 1,
      "minTemptingRoutes": 4,
      "wallWidthPt": 2.5,
      "solutionRouteWidthPt": 2.0,
      "collectibleScale": 0.54,
      "deadEndScale": 0.48,
      "timeBudgetSeconds": 30.0
    },
    {
      "mazeIndexMin": 41,
      "mazeIndexMax": 48,
      "actName": "The Long Way Home",
      "rows": 16,
      "cols": 16,
      "loops": {
        "min": 8,
        "max": 10
      },
      "deadEnds": {
        "min": 8,
        "max": 9
      },
      "deadEndDepth": {
        "min": 1,
        "max": 5
      },
      "candies": {
        "min": 13,
        "max": 15
      },
      "simpleRoutes": {
        "min": 16,
        "max": 200000
      },
      "minLoopLength": 6,
      "minMargin": 1,
      "minTemptingRoutes": 4,
      "wallWidthPt": 2.5,
      "solutionRouteWidthPt": 1.9,
      "collectibleScale": 0.52,
      "deadEndScale": 0.46,
      "timeBudgetSeconds": 45.0,
      "candyPlacementTrials": 600
    },
    {
      "mazeIndexMin": 49,
      "mazeIndexMax": 50,
      "actName": "Finale",
      "rows": 18,
      "cols": 18,
      "loops": {
        "min": 10,
        "max": 12
      },
      "deadEnds": {
        "min": 9,
        "max": 10
      },
      "deadEndDepth": {
        "min": 1,
        "max": 6
      },
      "candies": {
        "min": 16,
        "max": 18
      },
      "simpleRoutes": {
        "min": 20,
        "max": 200000
      },
      "minLoopLength": 6,
      "minMargin": 1,
      "minTemptingRoutes": 5,
      "wallWidthPt": 2.25,
      "solutionWallWidthPt": 1.2,
      "solutionRouteWidthPt": 1.8,
      "collectibleScale": 0.5,
      "deadEndScale": 0.44,
      "timeBudgetSeconds": 60.0,
      "candyPlacementTrials": 800
    }
  ]
}
