{
  "schemaVersion": "1.0",
  "profileId": "adult",
  "description": "Two long acts for an adult book, 16x16 and 18x18, with the loop budget at the PRD's ceiling and 15 to 21 candies per maze. deadEndDepth.min is 1 in both bands: it was 3, which asked the braid rebalancer for something it has no move to produce -- a dead end is created by opening an edge at a degree-1 cell, which leaves a depth-1 stub, and the depth ceiling is what shapes difficulty here, not the floor. The 0.8 tempting fraction is safe at these candy counts: a decoy needs 15 of a best 18, which leaves room under the uniqueness rule.",
  "ageLabel": "adult",
  "defaults": {
    "simpleRoutes": {
      "min": 24,
      "max": 200000
    },
    "minLoopLength": 6,
    "minMargin": 1,
    "shortestMayBeBest": false,
    "maxBestOverShortest": 2.5,
    "minTemptingRoutes": 6,
    "temptingFraction": 0.8,
    "maxRoutes": 200000,
    "maxSearchNodes": 8000000,
    "timeBudgetSeconds": 60.0,
    "candyPlacementTrials": 800,
    "frequencyBand": {
      "min": 0.25,
      "max": 0.65
    },
    "explorationShare": 0.45,
    "wallWidthPt": 2.0,
    "solutionWallWidthPt": 1.0,
    "solutionRouteWidthPt": 1.6,
    "collectibleScale": 0.48,
    "deadEndScale": 0.42,
    "startScale": 0.55,
    "finishScale": 0.62,
    "cellClearanceFraction": 0.08,
    "candySpacingPolicy": "no-adjacent-in-corridor-run",
    "maxBorderHugFraction": 0.4,
    "maxUnreachableFraction": 0.35
  },
  "bands": [
    {
      "mazeIndexMin": 1,
      "mazeIndexMax": 25,
      "actName": "Opening",
      "rows": 16,
      "cols": 16,
      "loops": {
        "min": 9,
        "max": 11
      },
      "deadEnds": {
        "min": 9,
        "max": 11
      },
      "deadEndDepth": {
        "min": 1,
        "max": 10
      },
      "candies": {
        "min": 15,
        "max": 18
      },
      "simpleRoutes": {
        "min": 24,
        "max": 200000
      }
    },
    {
      "mazeIndexMin": 26,
      "mazeIndexMax": 50,
      "actName": "Endgame",
      "rows": 18,
      "cols": 18,
      "loops": {
        "min": 10,
        "max": 12
      },
      "deadEnds": {
        "min": 10,
        "max": 12
      },
      "deadEndDepth": {
        "min": 1,
        "max": 11
      },
      "candies": {
        "min": 18,
        "max": 21
      },
      "simpleRoutes": {
        "min": 28,
        "max": 200000
      },
      "timeBudgetSeconds": 90.0
    }
  ]
}
